id,imageUrl,author,title,content,rate,like
1,https://cataas.com/cat?random=1,bestplayerever,Great Game!,This game is simply awesome! I’ve been playing it for hours, and I can't stop. Highly recommended.,5,87
2,https://cataas.com/cat?random=2,coolgamer,Decent Game,A fun game to play, but it could use some improvements in graphics and controls.,4,52
3,https://cataas.com/cat?random=3,eliteplayer,Amazing Adventure,This game offers an amazing adventure! The graphics are superb, and the storyline is engaging.,5,91
4,https://cataas.com/cat?random=4,gamemaster,Challenging and Fun,If you're looking for a challenge, this game is for you. The levels are difficult but rewarding.,4,76
5,https://cataas.com/cat?random=5,topgamer,A Solid Experience,This game offers a solid experience with great replayability and fun mechanics.,5,63
6,https://cataas.com/cat?random=6,winner2024,Good but Glitchy,A good game overall, but it has some bugs and glitches that need to be fixed in future updates.,3,45
7,https://cataas.com/cat?random=7,nightwarrior,Intense Gameplay,The gameplay is intense and fast-paced. Great for competitive players!,5,92
8,https://cataas.com/cat?random=8,frostking,Visually Stunning,The graphics in this game are breathtaking! Every scene is a visual masterpiece.,4,88
9,https://cataas.com/cat?random=9,starfighter,Overhyped,This game was a bit overhyped. The storyline falls flat after a few hours of gameplay.,3,59
10,https://cataas.com/cat?random=10,dragonrider,Must Play!,If you are a fan of adventure games, this is a must-play. The quests are exciting, and the world is vast!,5,94
11,https://cataas.com/cat?random=11,swordmaster,Great Storyline,The storyline is captivating and kept me interested until the end. A must-play for story-driven gamers.,5,84
12,https://cataas.com/cat?random=12,stormbringer,Amazing Visuals,The visuals are stunning and immersive. This game is a visual treat for all players.,5,78
13,https://cataas.com/cat?random=13,battlelord,Tough but Rewarding,This game is tough but very rewarding. It will challenge your skills at every level.,4,72
14,https://cataas.com/cat?random=14,shadowhunter,Action-Packed,The game is action-packed and keeps you on the edge of your seat throughout.,5,95
15,https://cataas.com/cat?random=15,championz,A Fun Time,This game is fun to play for a few hours but lacks depth for longer sessions.,3,64
16,https://cataas.com/cat?random=16,titanwarrior,Great Mechanics,The game mechanics are well thought out and executed. One of the best I've played.,5,91
17,https://cataas.com/cat?random=17,arcadegenius,Nostalgic Feel,The retro feel of this game brought me back to my childhood gaming days. Highly nostalgic.,4,76
18,https://cataas.com/cat?random=18,raiderking,Needs Improvement,There are a few aspects of the game that need improvement, especially the AI.,3,58
19,https://cataas.com/cat?random=19,speedracer,Fast and Fun,The game is fast-paced and thrilling. Perfect for those who love speed and action.,4,88
20,https://cataas.com/cat?random=20,rocketman,Exciting but Short,The game is exciting but too short. It left me wanting more.,3,62
21,https://cataas.com/cat?random=21,levelupking,Challenging Puzzles,If you enjoy solving puzzles, this game is for you. The difficulty scales nicely.,4,81
22,https://cataas.com/cat?random=22,stealthplayer,Stealthy Adventure,A great stealth game with lots of thrilling moments. I enjoyed sneaking through levels.,5,96
23,https://cataas.com/cat?random=23,speedrunner,Quick Fun,Great for quick gaming sessions. You can jump in and out easily without losing progress.,4,78
24,https://cataas.com/cat?random=24,wizardking,Great Magic System,The magic system in this game is complex and rewarding. I loved experimenting with different spells.,5,93
25,https://cataas.com/cat?random=25,cyberplayer,Tech-Themed Fun,The game has a cool tech-themed world that makes the experience fresh and futuristic.,4,82
26,https://cataas.com/cat?random=26,prodefender,Classic Defense,This is a classic defense game with a twist. It’s challenging yet fun!,4,76
27,https://cataas.com/cat?random=27,specialagent,Agent-Level Fun,This game makes you feel like a secret agent. Fun, thrilling, and full of surprises!,5,94
28,https://cataas.com/cat?random=28,mechwarrior,Mech Battles,The mech battles in this game are epic and immersive. Loved every moment of it.,5,97
29,https://cataas.com/cat?random=29,spacefighter,Space Combat at Its Best,This game features some of the best space combat I’ve ever experienced in a game.,4,89
30,https://cataas.com/cat?random=30,phantomassassin,Thrilling Adventure,The game offers thrilling combat and a gripping storyline. Definitely worth playing.,5,90
31,https://cataas.com/cat?random=31,dragonlord,Fire and Fury,This dragon-themed game is amazing. Controlling dragons and burning enemies never gets old.,5,96
32,https://cataas.com/cat?random=32,godmodeactive,Overpowered Fun!,This game makes you feel like an unstoppable force. It’s pure overpowered fun.,4,79
33,https://cataas.com/cat?random=33,thunderstrike,Electrifying Gameplay,The gameplay is fast-paced and electric! A great choice for action lovers.,5,92
34,https://cataas.com/cat?random=34,invisiblehunter,Stealth Masterpiece,This is one of the best stealth games out there. It keeps you hooked from start to finish.,5,95
35,https://cataas.com/cat?random=35,swiftdagger,Quick and Deadly,This fast-paced action game is incredibly fun. Quick reflexes are a must!,5,87
36,https://cataas.com/cat?random=36,prosniper,Precision is Key,This sniper game requires precision and patience. It’s both challenging and rewarding.,4,82
